author,author_profile_url,date_of_review,image_num,num_of_comments,pageURL,rating,review_content,title,verified,votes_helpful,,ranking,helpful_votes,total_review,visibility_status
Erin Kelly,/gp/profile/amzn1.account.AHECIMK4RZVI742O5LTKXLZLJAAA/ref=cm_cr_arp_d_gw_btm?ie=UTF8,"Reviewed in the United States on May 20, 2021",0,,https://www.amazon.com/SaluSpa-Miami-AirJet-Inflatable-Hot/product-reviews/B00HRT863U/ref=cm_cr_arp_d_paging_btm_6?ie=UTF8&pageNumber=6&reviewerType=all_reviews,4.0 out of 5 stars,"So I've had this for about a year. And I don't regret purchasing (for $308 in May 2020). It is perfect for a good soak for either one or two full sized adult humans. Temp doesn't go higher than 104 - but I can get a good half hour soak in and it doesn't dip below 100.It's very loud. And you can't have bubbles and heat on at the same time. But it's a $300 hot tub - so I don't mind.I am in the north east so deflate and empty late September, stored it out of the elements for the winter and put it back up mid April.A few things:1) don't spend more than $400 on this.  Price has seen crazy fluctuations over the past year.2) you will never fit 4 full sized humans in this comfortably without being on top of each other (totally cool if that's your thing)3) buy chemicals and take care of the water. I use bromine and it works well and keeps the water clean.4) if you're in colder climates - your electric bill will go up.","Good purchase, not a real hot tub so have reasonable expectations.",Verified Purchase,One person found this helpful,,17401471,20,9,Public
Kathryn Reyes,/gp/profile/amzn1.account.AHB3RS65PV3TJFAYEPMGWODBGT5A/ref=cm_cr_arp_d_gw_btm?ie=UTF8,"Reviewed in the United States on February 13, 2020",0,,https://www.amazon.com/SaluSpa-Miami-AirJet-Inflatable-Hot/product-reviews/B00HRT863U/ref=cm_cr_arp_d_paging_btm_6?ie=UTF8&pageNumber=6&reviewerType=all_reviews,1.0 out of 5 stars,"Read the update below! We have tried this product twice, once through Amazon, and both times after packing it away correctly for winter the pump would not work.  It read error, and that was it. I have two tubs with NO pump!Update: unable to find a replacement pump! I have tried several sites without luck. I now have an inflatable adult small pool with cold water. Don’t even consider buying this item. I reached out to the company and no one responded.","Only good for one season, pump will not work not Year.",Verified Purchase,3 people found this helpful,,1552213,13,51,Public
GG 57,/gp/profile/amzn1.account.AFDSTVPPRRW6BJ3KPSRXDPAW4MKQ/ref=cm_cr_arp_d_gw_btm?ie=UTF8,"Reviewed in the United States on April 12, 2019",0,,https://www.amazon.com/SaluSpa-Miami-AirJet-Inflatable-Hot/product-reviews/B00HRT863U/ref=cm_cr_arp_d_paging_btm_6?ie=UTF8&pageNumber=6&reviewerType=all_reviews,5.0 out of 5 stars,"Bought my first inflatable hot tub 4 years ago and was delighted with ease of setup and use, and how long lived it was-the original finally split on a seam and could not be repaired so I got this very similar replacement and set it up this week. Again, easy to set up even with marginally helpful instructions. Product has been upgraded since original purchase and is even better.  Excellent for 1-2 adults-you'd have to REALLY like your friends to fit 4 adults in this but it is perfect for me and so affordable.  Kudos to Amazon for delivering in an unmarked cover box, and although it says ""curbside"" delivery, it was left on my porch.  A bit heavy to move ( you can easily unpack it into smaller components boxed separately inside the original carton)  but manageable for this 61 yr old female.","Great value, easy to set up and manage, long lived!",Verified Purchase,2 people found this helpful,,979737,54,87,Public
Shana D,/gp/profile/amzn1.account.AE7H7P6MFL7I4YRQNPIG5236K5KQ/ref=cm_cr_arp_d_gw_btm?ie=UTF8,"Reviewed in the United States on June 22, 2020",0,,https://www.amazon.com/SaluSpa-Miami-AirJet-Inflatable-Hot/product-reviews/B00HRT863U/ref=cm_cr_arp_d_paging_btm_6?ie=UTF8&pageNumber=6&reviewerType=all_reviews,5.0 out of 5 stars,We’ve only had the hot tub for a week but so far love it! Heats up super fast we were in it within 12 hours of putting it together! Jets are powerful we were shocked how well they worked! Definitely recommend getting the chairs to sit on if your under 5”5 otherwise It will be uncomfortable to sit when the jets are going,Heats up fast& easy assembly!,Verified Purchase,3 people found this helpful,,5646422,3,18,Public
James,/gp/profile/amzn1.account.AFV7RF5CTFFR7HHDYCTNOUN42RVA/ref=cm_cr_arp_d_gw_btm?ie=UTF8,"Reviewed in the United States on March 28, 2020",0,,https://www.amazon.com/SaluSpa-Miami-AirJet-Inflatable-Hot/product-reviews/B00HRT863U/ref=cm_cr_arp_d_paging_btm_6?ie=UTF8&pageNumber=6&reviewerType=all_reviews,5.0 out of 5 stars,"The tub is well made and sturdy, very nice, though I'm just getting into using it. I turned it off after 1 use because I had to install privacy screening, having done that I turned it back on yesterday and today its fully heated and ready to go ..Its nice to spend 30 minutes in the tub at 5:00 AM, a pencil line of dawn, mist rising off of the ground, dark and silent, relaxing in the bubbles enjoying my morning coffee.6X6 is perfect for my space, and I'm pleased that its quite roomy for one or two .. Now if I'm struggling with words or music while composing, or stiff and achy from working in my wood shop or garden, I can toss it all up in the air and go soak in the tub while my local mocking bird challenges me to a duet, the bird actually flies into the tree by my patio and competes with me when I practice guitar on my patio, even changes key when I do..","It's well made, a very nice 'small' 6X6 unit ..",Verified Purchase,,,151833,147,219,Public
Michael Randolph,/gp/profile/amzn1.account.AFH5LVICAP2U2Q6AQRC6BOX236RQ/ref=cm_cr_arp_d_gw_btm?ie=UTF8,"Reviewed in the United States on February 27, 2020",5,,https://www.amazon.com/SaluSpa-Miami-AirJet-Inflatable-Hot/product-reviews/B00HRT863U/ref=cm_cr_arp_d_paging_btm_6?ie=UTF8&pageNumber=6&reviewerType=all_reviews,5.0 out of 5 stars,"The first thing I would say is that this is extremely easy to set up, but make sure your connections are made correctly and tight. I cross threaded mine slightly and when I filled it, it leaked quite badly over night. No issues though, i just found the connection that was leaking, put the cap on the inside of the tub to prevent water from leaking out, and backed off the threads, realigned and voila, fixed!The tub works great for what it is designed for. I have it setup in the garage so I can use this winter, not saying it couldn't be used outside in the winter, but i do not have a patio yet as i just built a new house. So this works for me. The tub is durable and has a comfortable base that your butt sits on and is perfect height for me (6'2) to rest my arms on the sides comfortably and watch tv & drink bourbon. It heats up to 104 degrees and is actually 104 degrees, i bought a thermometer to double check. The cover for the top is awesome and fits very well and has child prevention tabs on the clasps to help prevent accidents.The only 2 things I did not like: Firstly, is that they do not tell you what chemicals you need for start up or maintenance. That actually kind of irritated me quite a bit. It was a guessing game for a week or so. Secondly, there is no way 4 people could get in this thing and sit comfortably. My brother and I sat in it one night and that was all the room there is. I would say if you get anymore than 2 people in this, you will be cramped and unhappy. I bought for me, and only me so I am totally happy! It is helping my sore back!However, I am a believer that an inflatable tub works as well as the big $10k tubs. And at $300, you cannot go wrong!",Not for 4 People - Otherwise GREAT!!!,Verified Purchase,,,18903387,20,24,Public
Tim Ko,/gp/profile/amzn1.account.AGVKHIKLMBT4BLT3X4UQU7DZXUPA/ref=cm_cr_arp_d_gw_btm?ie=UTF8,"Reviewed in the United States on April 28, 2020",0,,https://www.amazon.com/SaluSpa-Miami-AirJet-Inflatable-Hot/product-reviews/B00HRT863U/ref=cm_cr_arp_d_paging_btm_7?ie=UTF8&pageNumber=7&reviewerType=all_reviews,5.0 out of 5 stars,"Just got this baby and set it up on Sunday. Set up was easy, but I was missing a part for the inflation of the big tub, so I had to rig something up to work. Set up was easy, I wish they had directions to accompany the pictures , but it came together in about 20 min. Water we put in was 47 degrees, and it too a full 24 hours to get to 95. Other than that, it works as it should, bubbles nice and feels like a real hot tub. The padded bottom is fine to sit in . 4 people will not fit into this unless you're kids. This is really a 2 person tub. The timer that shuts off every 72 hrs is pretty stupid.",Great for the money,Verified Purchase,One person found this helpful,,1278267,28,36,Public
Hoofsnhorns Farm Sanctuary,/gp/profile/amzn1.account.AHMSCNR346I6B7Y4QICSXIPZIUGA/ref=cm_cr_arp_d_gw_btm?ie=UTF8,"Reviewed in the United States on January 24, 2020",0,,https://www.amazon.com/SaluSpa-Miami-AirJet-Inflatable-Hot/product-reviews/B00HRT863U/ref=cm_cr_arp_d_paging_btm_7?ie=UTF8&pageNumber=7&reviewerType=all_reviews,2.0 out of 5 stars,I am very disappointed.i ordered two of them one for my mother and one for me. Shortly after set up one began to loose air.. Birth were set up in clean safe areas. We found no leak. The tub itself was replaced. Now the second one will not hold air we have tried and looked for any cause but maybe they just warranty built to pay very long? Haven't used it much but would sure like it to hold air. Useless now. Can't get a replacement and apparently the warranty was up a couple months ago. Very sad. Don't want to pay$200 for a liner plus shipping..in other words may as well buy another.. Not a good deal long term at all.,Don't hold air very long,Verified Purchase,2 people found this helpful,,1522325,21,42,Public
Myshell,/gp/profile/amzn1.account.AF26MSCSOVFQISOAQG7Y72FIVHHQ/ref=cm_cr_arp_d_gw_btm?ie=UTF8,"Reviewed in the United States on October 10, 2015",2,,https://www.amazon.com/SaluSpa-Miami-AirJet-Inflatable-Hot/product-reviews/B00HRT863U/ref=cm_cr_arp_d_paging_btm_7?ie=UTF8&pageNumber=7&reviewerType=all_reviews,5.0 out of 5 stars,"If you have been wanting a new hot tub, but are not willing to fork out 3 to 5 thousand for something that a few months down the road might not get much usage I recommend the Bestway Lay-Z-Spa Miami Hot Tub . It holds 4 people and gets just as hot as the hard sided ones and the jets give a great massage. Additional pros to this are it only takes one guy to lift it instead of 4. It runs on 110 so you can plug it into a regular household outlet without needing an electrician to hard wire it in. You can drain it easily and 1 person can move it to anywhere in the house or yard you want it as long as you have an outlet. It also has a very thick cushioned interior to sit or lay on which is way more comfy when compared to most other hot tubs that have hard seats and bottoms.  Plus the price is right so you can save your money for something else. I give this item 2 Thumbs Up!",Almost Paradise,Verified Purchase,16 people found this helpful,,9807682,16,4,Public
Juan Riccardi,/gp/profile/amzn1.account.AGGMMPD4BUKONUE6MBPEROMO2HVA/ref=cm_cr_arp_d_gw_btm?ie=UTF8,"Reviewed in the United States on January 6, 2019",1,,https://www.amazon.com/SaluSpa-Miami-AirJet-Inflatable-Hot/product-reviews/B00HRT863U/ref=cm_cr_arp_d_paging_btm_7?ie=UTF8&pageNumber=7&reviewerType=all_reviews,2.0 out of 5 stars,"First, the positive. Didn't last long, but it was fun to have in our back deck for as long as it lasted. Water does heat up to 104 degrees, and jets are as nice as can be expected for this type of hot tub.No the bad (the terrible). Exactly 10 months of moderate use after the purchase date, the hot tub started losing air, to the point of not being able to hold it for a day. Keep in mind, my wife and I followed the maintenance instructions highlighted in the service manual to a ""T"". With confidence I called Bestway Usa knowing that they'd probably would take care of the problem, given that there was a 1 year warranty on it, and given that I didn't do any damage to the hot tub, but rather it stopped working the way it was supposed to on its own.During the first conversation, they told me I had a 1 year warranty on it, however the ""liner"" of the hot tub only has 6 moths. That meant that they wouldn't do anything  to help me. So first they send me a new valve (only because I asked for one, otherwise they were ready to sell me a new product). Valve didn't work, my hot tub was still deflating.During second phone call, I tell them new valve doesn't fix the issue. They offer me the option of buying a new liner, since I already had a pump. The cost with shipping was already about 65% of the total I paid for the hot tub to begin with, brand new. But I did enjoy having it while it worked, so I decided to give it another shot, and bought the new liner. They did tell me that they were out of stock of my specific liner, but that they had a compatible version which would fit all my other parts.So I receive the new liner (this time a Coleman instead of a MiamiSpa), and everything works, except it is definitely and noticeably smaller than the first one I had. I could notice is by putting the original lid the first one came with, and it wouldn't fit.Which takes me to my last and final phone call. Even after maintaining the product as instructed, even after calling the manufacturer Best Way within less than 1 year of use, and even after selling me a considerably different product than the one I called them about (which they said was the same size), all I got was a customer service agent (who was trying her best to be nice), but that ultimately hung up on me after I requested to speak to a manager.I hope my experience helps you make a decision on whether you'd like to spend over $300 on this product. If you just want to have fun for a few months with it, for that price, then buy it. But I was the most disappointed with the company's costumer service, who took advantage of my situation to make more money out of me, and wasn't concerned with solving my problem.",Deflated after < 1 yr of purchase. Bestway (manufacturer) has terrible customer service.,Verified Purchase,One person found this helpful,,7870378,6,15,Public
Kara S.,/gp/profile/amzn1.account.AH2EVXNIC5LI5QM6TH2N7NZBRP4Q/ref=cm_cr_arp_d_gw_btm?ie=UTF8,"Reviewed in the United States on May 15, 2020",0,,https://www.amazon.com/SaluSpa-Miami-AirJet-Inflatable-Hot/product-reviews/B00HRT863U/ref=cm_cr_arp_d_paging_btm_7?ie=UTF8&pageNumber=7&reviewerType=all_reviews,3.0 out of 5 stars,"Generally like this spa, but after less than 6 months of use, the rubber flapper that keeps the water from coming out of the air intake (the door where the air comes from the filter for the bubbles) has failed and now despite Teflon tape on the connection, water constantly runs out of that connection.  I have to fill the tub every other day.  Also, the bubble area only goes 3/4 or less of the way around the tub and the air pressure is really too high to enjoy.  Also, the pump/filter tends to just randomly turn off on it's own all the time for no reason.  I find I have to check it daily if I want to use it.  Going to try and contact the seller to see if they will send me a new spa in the hopes that it doesn't leak like a sieve.  Will probably spend more on a better model next time.",Leaks and turns off all the time.,Verified Purchase,,,9924034,55,60,Public
RadioGuy,/gp/profile/amzn1.account.AE6MHG57CIGSIENRFKFF7SBCAW4Q/ref=cm_cr_arp_d_gw_btm?ie=UTF8,"Reviewed in the United States on August 17, 2020",0,,https://www.amazon.com/SaluSpa-Miami-AirJet-Inflatable-Hot/product-reviews/B00HRT863U/ref=cm_cr_arp_d_paging_btm_7?ie=UTF8&pageNumber=7&reviewerType=all_reviews,5.0 out of 5 stars,"I've had this for two months, and so far, no complaints! I bought it for my three kids (between 2 and 9) so they have a place to play in the water and not freeze from the barely-room temperature water.I keep the heat at 95F. Not too hot for the kids, but warm enough they can play for a long time and not get blue lips.The bubbles feature I haven't used a lot. It was a novelty at first, with the kids, but my youngest didn't like the bubbles so it's not turned on often. I've gone in it a whopping one time and had the bubbles going.Much to my happy surprise, I'm not having to inflate... well anything. The cover has stayed inflated, the tub itself remains sturdy after almost every day use, for the past two months. Definitely worth the buy!",Definitely recommend it,Verified Purchase,,,1539345,184,56,Public
D,/gp/profile/amzn1.account.AEUT3VKIOLNWRNGQGQCZ4WNA3DHQ/ref=cm_cr_arp_d_gw_btm?ie=UTF8,"Reviewed in the United States on December 20, 2016",0,,https://www.amazon.com/SaluSpa-Miami-AirJet-Inflatable-Hot/product-reviews/B00HRT863U/ref=cm_cr_arp_d_paging_btm_7?ie=UTF8&pageNumber=7&reviewerType=all_reviews,1.0 out of 5 stars,The top and bottom liner chambers blew out and went oblong within 8 months. The pump started howling and grinding within 10 months.Yes they warranty the parts but the parts only not a whole new unit and you can bet it's the same flawed product being sent out and it will do the same thing 8 and 10 months from now. They won't warranty any of their replacements parts on round 2 of failures either.,Buy a higher quality unit and save yourself the headache.,Verified Purchase,14 people found this helpful,,14589576,26,20,Public
D. Obryen,/gp/profile/amzn1.account.AFNMJAMHFJKWDGYKMMUMWP75VLZA/ref=cm_cr_arp_d_gw_btm?ie=UTF8,"Reviewed in the United States on April 8, 2020",0,,https://www.amazon.com/SaluSpa-Miami-AirJet-Inflatable-Hot/product-reviews/B00HRT863U/ref=cm_cr_arp_d_paging_btm_7?ie=UTF8&pageNumber=7&reviewerType=all_reviews,5.0 out of 5 stars,"I got this hot tub back in 2018. I live in flordia and It was great when I first got it. Started to get tired and I neglected for over two years. Just didnt have the time to use it nor clean it anymore. Well today I went out there and cleaned it took awhile it was nasty.So after two years just sitting out in my backyard it pretty much still looks pretty good. After the cleaning of course. Now my first thing to check was the pump/heater. I plugged it in and it came on and I mean everything worked. The bubbles the filters and the heat all work very good. Very impressed I told my self. They only thing that was wrong with it is the rubber rings sealing the water from leaking were crap and cant use them, so as it is right now its leaking, but I'm sure I can find some rings to fit on it. I would buy it again if I had too because this thing was built to last.",Built with quality in mind.,Verified Purchase,,,14714161,4,29,Public
Peggy Faranda,/gp/profile/amzn1.account.AE77JVYT6YL5F6WBZKTHN6IC3Q3Q/ref=cm_cr_arp_d_gw_btm?ie=UTF8,"Reviewed in the United States on August 10, 2020",1,,https://www.amazon.com/SaluSpa-Miami-AirJet-Inflatable-Hot/product-reviews/B00HRT863U/ref=cm_cr_arp_d_paging_btm_7?ie=UTF8&pageNumber=7&reviewerType=all_reviews,4.0 out of 5 stars,"No real assembly instructions but I found a YouTube video that helped.  Bought this on a lightning deal in January and didn’t set it up til July but for the price it’s been really impressive.  We use it all the time now, both to relax in at its warmest temp, which is plenty hot, and to cool down in on a hot day.  Didn’t expect much from the jets but they really do help in the relaxation process.  Only thing we did wrong was not filtering the water that we drew straight from our hose at the spigot which pulls directly from our well.  The water turned rust colored after a few days, even when all the chemicals needed were added.  Eventually the water corrected itself and was clear again.  Also would be handy to have a recommended chemical starter kit as I just winged it.",Impressive little hot tub,Verified Purchase,,,354204,144,118,Public
snody,/gp/profile/amzn1.account.AFYBBGGVPHRRI7UA62R5Q4YRRAEA/ref=cm_cr_arp_d_gw_btm?ie=UTF8,"Reviewed in the United States on October 30, 2016",0,,https://www.amazon.com/SaluSpa-Miami-AirJet-Inflatable-Hot/product-reviews/B00HRT863U/ref=cm_cr_arp_d_paging_btm_7?ie=UTF8&pageNumber=7&reviewerType=all_reviews,5.0 out of 5 stars,"Bought one of these a few years back for my wife as a birthday gift. It works good enough for the first two years that I would have bought a new one without even thinking about it..... and on the third year it really impressed me. It had popped at the end of the prior season and I had to fix a leak, which I did with a hot glue gun and we were back in action. This little hot tub compared to the cost of a conventional one is unbelievable(just to wire in a conventional hot tub would have paid all costs incurred for the whole three years ive had it..including purchase cost). Set up is easy. Size is perfect for two. If you don't use it all year long it is easy to store until the following season. It involves alone time in hot water with my wife for less than $ 400....... some of the best money Ive EVER spent.Update 2/18 /17Had to retire the original and buy the new model. The old one would not hold air any longer. The new version has a few updated features and is a little bit different dimensions. I still recommend  this as one of the best purchases someone can make.  Adam S.",It works good enough for the first two years that I would ...,Verified Purchase,11 people found this helpful,,4935701,28,28,Public
Spike,/gp/profile/amzn1.account.AG3RHWKE5IBK7IMWQ3SIDEUPBF3Q/ref=cm_cr_arp_d_gw_btm?ie=UTF8,"Reviewed in the United States on May 6, 2021",0,,https://www.amazon.com/SaluSpa-Miami-AirJet-Inflatable-Hot/product-reviews/B00HRT863U/ref=cm_cr_arp_d_paging_btm_8?ie=UTF8&pageNumber=8&reviewerType=all_reviews,4.0 out of 5 stars,"The spa does have a padded bottom (approx 1"").  It does not come with the ""egg"" shaped heater, but has the rectangular one with flip up control panel. Apparently since the 2018 models, the heater now continues to run with the bubble function on. Control unit runs with a slight hum, and cannot be heard with bubbles on.  Temp will drop 5 degrees at start of session, but remain there during moderate soaking times. I find the Chem Connect inconvenient and use a floater instead. Overall satisfied!",Things not in the product description.,Verified Purchase,One person found this helpful,,1117353,33,35,Public
Peng V.,/gp/profile/amzn1.account.AEAKRX6BY6ZBI6V2TE73Q4267G2Q/ref=cm_cr_arp_d_gw_btm?ie=UTF8,"Reviewed in the United States on May 25, 2021",0,,https://www.amazon.com/SaluSpa-Miami-AirJet-Inflatable-Hot/product-reviews/B00HRT863U/ref=cm_cr_arp_d_paging_btm_8?ie=UTF8&pageNumber=8&reviewerType=all_reviews,1.0 out of 5 stars,"The product and customer service is just as poor quality as the part. Had this for 8 months and used it like once or twice a week in the summer and had it recirculating over the winter. The seam of the ribs inside of the liner came apart and leaked air out. I've contacted BestWay for the warranty claim and that same day they changed the warranty claim on liner/tub defects to 90 days, go look this up (April was the recent change).  They said they will honor my claim if I show proof of my warranty that stated 1 year on defected of the tub.  I submitted the copy of the warranty that came with my unit that stated ""365 days limited warranty through a replacement that your product will be free from manufacturer's defects resulting in leaks"" and they still did not honor it claiming they can change the warranty at anytime.Now I have a pile of vinyl and a spa pump that is completely junk. Will not buy from BestWay again. Save your money and buy a plug and play spa for a little more, under $1,500.",Poor  quality and poor customer service and warranty claims.,Verified Purchase,,,1409265,49,18,Public
Amazon Customer,/gp/profile/amzn1.account.AHB27XNLOPQSCPBSSOU7W7XGMXBQ/ref=cm_cr_arp_d_gw_btm?ie=UTF8,"Reviewed in the United States on May 28, 2020",0,,https://www.amazon.com/SaluSpa-Miami-AirJet-Inflatable-Hot/product-reviews/B00HRT863U/ref=cm_cr_arp_d_paging_btm_8?ie=UTF8&pageNumber=8&reviewerType=all_reviews,3.0 out of 5 stars,This lasted about 6 months.I've bought a couple of these and I have to replace them about every 6 months or so.What happens is they develop a leak and there is no way to fix the leak because it is where there is a weakness in the design. This latest leak happened at the drain plug. There is a plastic washer around the plug. Somehow it got chipped and does not sit flush anymore. Because of that it leaks and we have to throw away the entire thing. It feels like a huge waste for such a small problem.,I wish they were more easily repaired,Verified Purchase,One person found this helpful,,83964220,121,101,Public
