author,author_profile_url,date_of_review,image_num,num_of_comments,pageURL,rating,review_content,title,verified,votes_helpful
Nick,amzn1.account.AF6PZG4JJ2SJFSZUOEH5EXS4RRBQ,"Reviewed in the United States on February 21, 2019",0,,https://www.amazon.com/Lodge-America-Pre-Seasoned-12-Inch-Skillet/product-reviews/B0009JKG9C/ref=cm_cr_arp_d_paging_btm_next_2?ie=UTF8&reviewerType=all_reviews&pageNumber=8,5.0 out of 5 stars,"I grew up in a very blue box Mac n cheese household and regarded cast iron as somewhat mystical for a long time. “You’ll ruin the seasoning,” etc.As years wore on I got to be a better cook and eventually took on cast iron cookware. And now I realize I was late to the party!First of all, this pan is huge. You can’t lift it with one hand and two takes some effort. In fact, everyone makes fun of me and my “giant cast iron pan”, but I use it for everything and it’s roomy enough to spread things out. Heck I even make 3 pancakes at once in it.Turns out cast iron is the original non-stick cookware and caring for it is as easy as 1-2-3:1. While hot, wash after you’ve plated your meal. Just use hot water and a nylon scrub brush, no need to use soap, the whole operation takes ten seconds.2. Dry it off right away with a towel.3. Pour in a little oil and smear it around with a paper towel. Park it on the stove for next time. You are done!",Cast iron: from mystical to magic,Style: SkilletSize: 15-InchVerified Purchase,7 people found this helpful
Ella Belle,amzn1.account.AEQLMIHUAWAC5TQGPJR2P7XDNIYA,"Reviewed in the United States on April 8, 2019",0,,https://www.amazon.com/Lodge-America-Pre-Seasoned-12-Inch-Skillet/product-reviews/B0009JKG9C/ref=cm_cr_arp_d_paging_btm_next_2?ie=UTF8&reviewerType=all_reviews&pageNumber=8,3.0 out of 5 stars,"I basically like most of my Lodge Cast Iron ware. I bought 2 of these Lodge 3.5 Inch Cast Iron Mini Skillets to use for cooking 1 egg for each pan. One pan arrived fairly smooth inside, enough to cook an egg with a lot of butter or oil and get mot of the egg out of it. The other pan arrived super textured inside, so much that no matter how much oil I put in it, the egg stuck really bad. I kept both pans and I'm going to see if my husband will grind smooth the rougher little pan. If he screws it up, I'l just use it as a spoon rest.  It sure seems like I ""win-some-loose-some"" with the inside finishes on most any size of the Lodge Cast Iron pans!",Cute Little Pan,Style: SkilletSize: 3.5-InchVerified Purchase,8 people found this helpful
Cherise,amzn1.account.AEHDKVFDJENTPQ46XPRMI3H5U2TQ,"Reviewed in the United States on September 12, 2021",3,,https://www.amazon.com/Lodge-America-Pre-Seasoned-12-Inch-Skillet/product-reviews/B0009JKG9C/ref=cm_cr_arp_d_paging_btm_next_2?ie=UTF8&reviewerType=all_reviews&pageNumber=8,5.0 out of 5 stars,"I never owned cast iron cookware before but from speaking with friends who had worked with cast iron before, as well as my own research, I understood what I was getting into.As my review title says, cast iron is HEAAAAVY! I’m not that strong of a person so maybe others are fine, but this skillet is not something I can easily hold in one hand while cooking. Luckily for the most part of cooking it is either sitting on the stove or I am just tilting it slightly and letting the stove hold the weight. That being said, the second part to remember is…Cast iron gets HOT!  That’s a good and bad thing. It gets hot and retains heat all over with even distribution, which means make sure you are using something to hold the handle. If you aren’t used to cooking with cast iron, you might forget this and accidentally touch the VERY hot handle after cooking which depending on how long ago you turned off the burner might result in a burnt hand.So now you have a very heavy, very hot pan which in some circumstances is a bit difficult to maneuver with. I originally purchased it for cooking steaks, specifically for sous vide steaks (I wanted that quick sear for the outside of the steak!). I use the method of lots of butter and ladling that butter with a spoon over the steak as it finishes searing. This was slightly tricky for me because of the weight and heat of the pan (I was tilting it and I had a cloth over the handle to hold it with, but it was still heavy and I could still feel a bit of that heat threatening to burn me if I slipped up!). I feel that with time I’ll get better at it, but man it’s a bit nerve wracking!Finally, the cleaning. Now I can be pretty ambitious and pretty lazy with things I do, including cooking. When I heard you have to do extra steps to keep your cast iron skillet in good shape, I put off buying one for a year. For those who don’t know, cast iron pans need to be seasoned before cooking and after cooking sometimes if you want them to maintain their non stick coating… or something. This Lodge cast iron comes preseasoned and you should be able to cook with it immediately, however many sites suggest seasoning it at least once anyway. I don’t know if I’m doing correctly, but I followed guides online and used vegetable oil, rubbed a thin layer all over my cast iron, handle and bottom too, and stuck it in an over at 450 degrees for an hour. Just in case I also put a baking sheet under it on a different shelf to catch any possible oil drippings. After an hour I turned off the oven and let it sit there until it was cool enough to touch. After cooking food with the cast iron, I read that soap and water can remove layers of the oil and in order to clean it you can either just wipe away the grease and food particles with a paper towel, or if food is stuck on, you can pour some salt on the pan and scrub it with a little bit of water. The salt acts as an abrasive and removes the stuck on food. You then rinse and dry as dry as you can because cast iron is prone to rusting. I do the extra step of hearing it for a little while on the stove top to dry off all water. And then finally, after turning off the stove burner, while the cast iron is still hot, I use a paper towel and again rub a new thin layer of vegetable oil all over it again. From what I understand, you don’t have to reseason your cast iron every time, and that cooking with oil does it anyway. However since I bought this thing, I feel like I want to keep it in good condition!Cast irons are niche and there are alternatives to cooking to get similar results, but i do like my purchase despite the heaviness and hotness and the seasoning. The sear on the steak turns out great after some practice, and  I just recently tried baking with it, which was really awesome!",Cast iron skillets are heavy! And don’t forget it!,Style: SkilletSize: 10.25-InchVerified Purchase,One person found this helpful
Henry Armitage,amzn1.account.AHQZUN2X6NDSQ7BWPMBJUIEVIB6A,"Reviewed in the United States on July 20, 2016",1,,https://www.amazon.com/Lodge-America-Pre-Seasoned-12-Inch-Skillet/product-reviews/B0009JKG9C/ref=cm_cr_arp_d_paging_btm_next_2?ie=UTF8&reviewerType=all_reviews&pageNumber=8,5.0 out of 5 stars,"This was my first cast iron pan. I had heard about them and their brilliant heat retaining properties. When I got it I read a few guides on how to use it. You always need just a bit more oil and time, as you have to transfer more heat into this pan to get started. Once you've done it, you have a brilliant cooking vessel for making tender vegetables, excellently browned meats, pizzas and even full pies. Just use the pan itself as the serving dish!There are lots of dishes I like in this but here are some highlights:* Pork Tenderloin (shown, with BBQ seasoning)* Steaks* Fajitas* Pancakes* Apple Pies* Breakfast Hash* Bacon (back or streaky)* Sausages... anything really.If you look at the history behind cast iron pans, people have been using them for years, for basically everything.You do have to care for your pan. Learn how to season it, learn what not to cook in it (high sugar items can be troubling) and learn how to clean and store it. On that last one, I heat it up to get it very dry, then rub it with a bit of coconut oil and let it cook into the iron. Before it all burns off, turn off the heat and just leave it. That will keep your seasoning happy.I can see this being passed on to my kids one dayPros:* Excellent heat retention* Brilliant browning on Meat and Veg* Virtually impossible to hurt it* It's fun to learn how to use it wellCons:* NoneNotes:* Requires reseasoning every so oftenI bought this with my own money",A pan you will give to your kids,Style: SkilletSize: 12-InchVerified Purchase,31 people found this helpful
MTN,amzn1.account.AE2LHHO5XQS5J66IEPFGHEPP3ECQ,"Reviewed in the United States on May 16, 2017",0,,https://www.amazon.com/Lodge-America-Pre-Seasoned-12-Inch-Skillet/product-reviews/B0009JKG9C/ref=cm_cr_arp_d_paging_btm_next_2?ie=UTF8&reviewerType=all_reviews&pageNumber=9,1.0 out of 5 stars,"The center of the skillet protrudes. It's higher than the sides. The oil runs down to the sides while the center is dry. As a result the center gets hotter, which means uneven cooking. It's junk.",Junk,Style: SkilletSize: 15-InchVerified Purchase,42 people found this helpful
K.,amzn1.account.AENJXTMUUPYBXKOYA3GMX4VODBEQ,"Reviewed in the United States on June 16, 2020",0,,https://www.amazon.com/Lodge-America-Pre-Seasoned-12-Inch-Skillet/product-reviews/B0009JKG9C/ref=cm_cr_arp_d_paging_btm_next_2?ie=UTF8&reviewerType=all_reviews&pageNumber=9,5.0 out of 5 stars,"This is my first cast iron skillet and I was worried about it rusting.  But after some research online I'm slowly getting a better understanding on how to use and care for this type of pan.  When it first arrive, I lightly cleaned the pan to wash away any residue from shipping (the box was very beaten up when it arrived).  The first thing I cooked was a fried egg and it did stick a little to the pan.  The key is to wait until the pan is hot before adding the oil and then the egg.  Depending on your stove type you'll need to figure out the strength of your fire (if a gas stove) or the heat on an electric stove.  The advice I found online said the skillet hasn't developed it's non stick surface yet.  So I made a few more fried eggs later in the week and it started to improve.  Each time I used the pan, I cleaned it right away with hot water and very minimal dish soap.  Then I placed the pan on the stove to dry off.  If the surface looked dull, I added a coating of oil.  A week later I cooked some bacon and that helped season the pan a bit more.  Today I made some fried chicken and after cleaning the pan of excess oil, my skillet is looking to be taking on a good surface.  It's not greasy or sticky.  I know eventually I'll get to sauté some vegetables, pan fry tofu, or make a few pieces of french toast without them sticking to the bottom.",This pan requires patience,Style: Skillet with Handle HolderSize: 10.25-InchVerified Purchase,4 people found this helpful
Trix678,amzn1.account.AH2LGBHPEWUERE6X5Z3IEN2VWPXQ,"Reviewed in the United States on December 31, 2020",0,,https://www.amazon.com/Lodge-America-Pre-Seasoned-12-Inch-Skillet/product-reviews/B0009JKG9C/ref=cm_cr_arp_d_paging_btm_next_2?ie=UTF8&reviewerType=all_reviews&pageNumber=9,5.0 out of 5 stars,"After using very expensive hard-anodized skillets for years (so that I didn't have to use butter or oil), they started to fail. When I went to get a replacement because they were guaranteed for 10 years, or life depending on who I asked, I was asked if I had been using oil and subsequently told that even though they were hard-anodized and didn't require oil, I should have been doing so. For health/ nutrition reasons, I had started to use ghee about two years ago so I did some more research and decided to throw away the hard-anodized (since it didn't stand up to what it says it does) and try cast iron.This is the second Lodge skillet I've purchased. With the first, I didn't know what I was doing and I struggled. Food stuck and clean up was a nightmare. Since I no longer had the hard-anodized to fall back on, I decided to really try with the new cast iron skillet (this one) by following recommendations I read on several websites for seasoning and cleaning (including buying a stainless steel enmeshed silicone sponge, scrapers and a scrub brush).Now, everything is great!! Food no longer sticks (although some things do still leave a little residue, e.g., scrambled eggs and salmon) and clean up is a breeze. I seasoned both skillets (bought the cast iron oil, which is really just flax seed oil I think, and put them through 5 seasoning cycles) and try to use both regularly. I clean them by rinsing with warm water immediately after cooking using the stainless steel sponge or brush; initially I was afraid the food would get cold, but the skillets clean in no time. Then I dry them well and put them back onto the stove top or in the oven to let the residual heat dry off any remaining moisture (I've read that rust can be a problem).The skillets do get hot and they hold the heat really well, so I've had to learn to cook a little differently, but nothing has burned, yet anyway. I do use a little ghee every time and try to make sure that I get it into and up on the edges as it melts. The red silicone handle that comes with the skillet is great at protecting my hand from the heat although I am careful to have another potholder nearby.When transferring the skillets to the sink to clean, this skillet is easily managed with one hand, but the original one I bought, which is larger, can wobble a bit due to its weight so two hands are needed.I know this is long, but I was so afraid of cast iron before really learning about it and wanted to share my experience to help anyone else thinking the same.I'm so glad I made the switch. From what I've read, it should get easier and easier to use as time goes by. It's my belief that's it's a healthier way to cook as well... and the browning on things like breakfast sausages is amazingly delicious!!!",So glad I made the switch!!,Style: Skillet with Handle HolderSize: 8-InchVerified Purchase,One person found this helpful
Lymarie Marron,amzn1.account.AHYG2OWVQ6RPPEXVEYVVYKYSRBLA,"Reviewed in the United States on October 9, 2021",5,,https://www.amazon.com/Lodge-America-Pre-Seasoned-12-Inch-Skillet/product-reviews/B0009JKG9C/ref=cm_cr_arp_d_paging_btm_next_2?ie=UTF8&reviewerType=all_reviews&pageNumber=9,1.0 out of 5 stars,"I bought a 10"" skillet in June. Used it 5-6x. I didn't love using it on the stove but did great on the grill. On the last use, the handle just broke off when I picked up off the grill. Just broke off, jalapeño poppers and bacon grease everywhere. I was honestly more mad about the wasted food and grease mess than the broken pan. It took me almost an hour to clean that mess up just because of this crappy product.My husband contacted Lodge and they had fantastic customer service, they asked for photos and details of the accident. A few days later they sent a replacement.We didn't immediately open the box with the replacement. About 4 days after we received it, I wanted to use it for nachos, only to find it was broken.I never knew cast iron cold just break like this. Maybe it's just this brand but I really don't want anything to do with this pan. I've requested a refund.",Broke TWICE!,Style: SkilletSize: 10.25-InchVerified Purchase,One person found this helpful
DaftPunked,amzn1.account.AH6ET4AAN57YSSKZ5N6Z57LGBKVA,"Reviewed in the United States on December 8, 2020",0,,https://www.amazon.com/Lodge-America-Pre-Seasoned-12-Inch-Skillet/product-reviews/B0009JKG9C/ref=cm_cr_arp_d_paging_btm_next_2?ie=UTF8&reviewerType=all_reviews&pageNumber=9,5.0 out of 5 stars,"Okay, so I waited a LONG time to review this, not purposely, but rather because I am going to buy a second one now and wanted to review!After 2 years, I can confidently say this is a GREAT buy for a multitude of reasons. Cast iron pans are so versatile and if you take care of them, will last a lifetime.First off, the seasoning it comes with is not the greatest. If you want, wash it off with warm water, some mild soap, and a wire/steel brush. Ensure you SEASON it after.In the beginning (first 20 uses), I would highly recommend you SEASON after EVERY use. It may seem excessive but it pays off, trust me.I prefer to use Flax-seed oil (not refrigerated), a rag (a few I have set aside only for this purpose) and a HOT oven. Go on youtube on how to properly season and do it religiously in the beginning. If you do it enough, afterwards you won't have to season every time (maybe every 3-5 times) and it'll have a beautiful non-stick layer.For cleaning, I've learned the best method is the following:1. Buy a Stainless Steel Chainmail Scrubber.2. Buy heat-resistant gloves (I already had some for my BBQ)3. Buy some regular sea salt if you don't have any (Mortons works well).Now, here's the process:1. As soon as you're done cooking in the pan, (food has been taken out), pour some salt into the pan (enough to cover the surface), throw the chainmail scrubber in there, and add about half a cup of water (enough to bring the water level to cover the entire bottom of the pan). Doesn't matter WHATS in the pan (eggs residue, fish, steak, chicken, sauce, etc.), this is the best way to start.2. Turn the heat on your stove to Low and let the water and salt warm up in the pan. I usually let this stage happen while I'm eating.3. When the water is hot and almost boiling in the pan, grab your heat resistant gloves and take the pan with the water, carefully, off the stove and over to your sink. While you're holding the pan with one hand, use your free hand to work the chain scrubber all over the pan and rinse under HOT water. If the pan is too heavy for you, you can let it rest on a heat-resistant mat on your counter or on your counter if you have marble/granite or any heat resistant counter-top.4. As you work the chain scrubber on your pan, the salt and hot water should basically help get everything off the surface of the pan. Run the pan under hot water and keep scrubbing until it's clean. Never use dish soap to clean the pan.5. Dry pan with specific tower or rag (this should not be a tower you would use for any other purpose as it will stain) and if you still want to dry more, put on stove top and turn on high for a few minutes to heat up the pan and evaporate any remaining water. Ensure your pan is DRY as any remaining water will RUST the pan.6. Season if you need to.All in all, excellent pan and after 2 years, still looks new following the process above. I've used it for eggs/breakfast, salmon, steak, fish, pasta sauce, potatoes, frying, and pretty much everything else and it's as good as day 1.I've seasoned it enough now that without any oil, I can cook eggs on it and it will not stick. Though I never do this, as I like to throw in a little butter to fry my eggs in the morning!",2 year review!,Style: Skillet with Handle HolderSize: 12-InchVerified Purchase,One person found this helpful
Jodie Long,amzn1.account.AEOVW4TS2CG5Y3RVFMBINRHMW6DA,"Reviewed in the United States on January 27, 2021",0,,https://www.amazon.com/Lodge-America-Pre-Seasoned-12-Inch-Skillet/product-reviews/B0009JKG9C/ref=cm_cr_arp_d_paging_btm_next_2?ie=UTF8&reviewerType=all_reviews&pageNumber=10,4.0 out of 5 stars,"This pan is incredibly well crafted!! My jaw hit the floor to see cast iron so inexpensively made in America! However. When I got it(10""), the first thing we noticed was a rougher than normal texture on the cooking surface. On the whole pan, actually! Thankfully, we have a dremel and will get to work on smoothing it down. I have zero issue with this though because of how inexpensive it was and it's Made in America. I'll sand it down, idc. But just so everyone is aware: you do not have to smooth it down. This is a personal preference. And if you do, make sure to season the whole deal all over again. Which I planned on doing anyway.The handle is so short! However, this is actually works to my advantage because I have smaller than normal hands, so it fits me like a glove but in reverse! Plus it has the other handle on the opposite side that I just LOVE.The weight of it is heavier than normal, as far as I know. Which, admittedly, isn't far at all. In fact, it's right around the corner there past ""Idk Rd"" and ""Sure Thing Boss Blvd""Overall, I have to give this pan 4/5 stars. Because of that finish. I must. Personal preference or not, I shouldn't have to alter any product to make it desirable, should I? Idk. Maybe I'm being too nitpicky about it. Regardless, I'm going to stick with 4 stars. If not for the finish, minus one for making me say nitpicky.",May Be A Nitpicker,Style: SkilletSize: 10.25-InchVerified Purchase,One person found this helpful
Dionisio L Yang,amzn1.account.AGYPJ7Z2RHPKN4YNIIVCAWELYT5A,"Reviewed in the United States on April 1, 2020",0,,https://www.amazon.com/Lodge-America-Pre-Seasoned-12-Inch-Skillet/product-reviews/B0009JKG9C/ref=cm_cr_arp_d_paging_btm_next_2?ie=UTF8&reviewerType=all_reviews&pageNumber=10,5.0 out of 5 stars,"My first iron skillet, and I regret not buying one SOONER!  I've realized Teflon pans is a product of good marketing.  Why?  Certain things are better cooked in high heat such as  Meats, steak, sausages, breakfast meats to get the charred marks and High heat COOKS MUCH FASTER.  High heat destroys Teflon pans but most cooking I usually use high heat.  So, that's why people tend to destroy Teflon Pans, but here's the marketing...  Teflon cleans easier.  That's the biggest bunch of baloney, just so people will think they can clean faster.  But guess what?  Meats cook FASTER in iron skillet.  So while you SAVE time washing none stick pans, you SAVE a lot of time cooking meats in an iron skillet.  And by cooking in High Heat, people destroy Teflon pans that they have to replace $$$ over and over and over again.  That said, Teflon has it's benefits.  I would use anything that can be cooked in medium heat on Teflon pans.In conclusion,I would use Teflon for things like eggs, omelettes, cheese, where you only need medium heat to cook.I am now ONLY going to use Iron Skillet pans for any kind of meat cooking, stews, stir fry, that requires High heat cooking, and I will NEVER have to replace another Teflon pan again.",Teflon vs Iron Skillet,Style: SkilletSize: 10.25-InchVerified Purchase,2 people found this helpful
J. Miller,amzn1.account.AHUQQJ6SUUON2R2SVQ4JQVMFPYVA,"Reviewed in the United States on April 3, 2020",0,,https://www.amazon.com/Lodge-America-Pre-Seasoned-12-Inch-Skillet/product-reviews/B0009JKG9C/ref=cm_cr_arp_d_paging_btm_next_2?ie=UTF8&reviewerType=all_reviews&pageNumber=10,5.0 out of 5 stars,"Well I bought this five years ago and figured it’s probably time to write a review.  Up until last year it was my only pan. I cooked fish, pizza, sauces, meats, eggs etc.  About a year ago it started having sticking issues. I fought with it on and off trying to get it to reseason.  I finally fixed it yesterday and had scrambled eggs sliding around better than a nonstick panIssues: smoking is a problem, it heats up real hot and the oils you add start smoking. Sucks if you don’t have great ventilation which is us.  So I had a lot of trouble getting a reseason as I cant use the oven to do it without filling the house with burnt oil smell.  There doesn’t seem like to be a way around this unless you have a grill or good ventilationI used my charcoal grill fired up to 500f for three hours after scouring the pan and put on  thin layers of flax oil every 45 mins.  This morning it was better than our non stick pan which is definitely seeing its end of days after one year of use. So after five years it’s like brand new which is exciting.  That’s something you just can’t do with other pans.  I ha e no doubt it’ll last my lifetime as long as I don’t temperature shock it.",Frustrating but amazing,Style: Skillet with Handle HolderSize: 12-InchVerified Purchase,2 people found this helpful
